{
  "schema_version": 1,
  "revision": 2,
  "published_at": "2026-09-28T00:00:00Z",
  "country": "NL",
  "currency": "EUR",
  "suppliers": {
    "zonneplan": {
      "name": "Zonneplan",
      "tariffs": [
        {
          "valid_from": null,
          "valid_until": "2026-07-31",
          "purchase_fee_import": 0.02,
          "purchase_fee_export": 0.02,
          "fixed_monthly_fee_electricity": 6.25,
          "vat_included": true,
          "export_vat_included": true,
          "settlement_resolution": "hourly",
          "source_type": "official",
          "source_url": "https://www.zonneplan.nl/blog/kwartierprijzen-bij-zonneplan",
          "last_verified": "2026-07-03",
          "notes": "Legacy bundled snapshot; original contract start is unknown. Values have not been freshly verified as a complete tariff. Check your contract.",
          "feed_in_fee": 0,
          "imbalance_fee": null,
          "profile_version": 2,
          "supports_hourly_prices": true,
          "supports_quarter_hour_prices": true
        },
        {
          "valid_from": "2026-08-01",
          "valid_until": null,
          "purchase_fee_import": 0.02,
          "purchase_fee_export": 0.02,
          "fixed_monthly_fee_electricity": 6.25,
          "vat_included": true,
          "export_vat_included": true,
          "settlement_resolution": "quarter_hour",
          "source_type": "official",
          "source_url": "https://www.zonneplan.nl/energie/dynamisch-energiecontract",
          "last_verified": "2026-07-03",
          "notes": "Import fee EUR 0.02 including VAT and quarter-hour pricing checked 2026-09-23. Monthly/export values retained; full tariff verification date not advanced. Zonnebonus is not modeled.",
          "feed_in_fee": 0,
          "imbalance_fee": null,
          "profile_version": 2,
          "supports_hourly_prices": true,
          "supports_quarter_hour_prices": true
        }
      ]
    },
    "tibber": {
      "name": "Tibber",
      "tariffs": [
        {
          "valid_from": null,
          "valid_until": "2026-08-31",
          "purchase_fee_import": 0.0248,
          "purchase_fee_export": 0.0248,
          "fixed_monthly_fee_electricity": 5.99,
          "vat_included": true,
          "export_vat_included": true,
          "settlement_resolution": "hourly",
          "source_type": "official",
          "source_url": "https://tibber.com/nl/energiecontract",
          "last_verified": "2026-07-03",
          "notes": "Legacy bundled snapshot; original contract start is unknown. Values have not been freshly verified as a complete tariff. Check your contract.",
          "feed_in_fee": 0,
          "imbalance_fee": null,
          "profile_version": 2,
          "supports_hourly_prices": true,
          "supports_quarter_hour_prices": false
        },
        {
          "valid_from": "2026-09-01",
          "valid_until": null,
          "purchase_fee_import": 0.018,
          "purchase_fee_export": 0.018,
          "fixed_monthly_fee_electricity": 6.99,
          "vat_included": true,
          "export_vat_included": true,
          "settlement_resolution": "quarter_hour",
          "source_type": "official",
          "source_url": "https://tibber.com/nl/energiecontract",
          "last_verified": "2026-09-23",
          "notes": "Published standard tariff from 2026-09-01. Older contracts may retain their agreed monthly fee; use Custom supplier for contract-specific rates. See https://support.tibber.com/nl/articles/5605892-de-kosten-bij-tibber",
          "feed_in_fee": 0,
          "imbalance_fee": null,
          "profile_version": 2,
          "supports_hourly_prices": true,
          "supports_quarter_hour_prices": true
        }
      ]
    },
    "anwb_energie": {
      "name": "ANWB Energie",
      "tariffs": [
        {
          "valid_from": null,
          "valid_until": null,
          "purchase_fee_import": 0.018,
          "purchase_fee_export": 0.018,
          "fixed_monthly_fee_electricity": 8.5,
          "vat_included": true,
          "export_vat_included": true,
          "settlement_resolution": "hourly",
          "source_type": "official",
          "source_url": "https://www.anwb.nl/energie/actuele-tarieven",
          "last_verified": "2026-07-03",
          "notes": "Import EUR 0.018 incl VAT, monthly EUR 8.50 incl VAT and hourly settlement checked 2026-09-23; see https://www.anwb.nl/energie/hoe-werkt-anwb-energie . Export fee remains unverified legacy data; complete-record last_verified retained.",
          "feed_in_fee": 0,
          "imbalance_fee": null,
          "profile_version": 2,
          "supports_hourly_prices": true,
          "supports_quarter_hour_prices": false
        }
      ]
    },
    "easy_energy": {
      "name": "EasyEnergy",
      "tariffs": [
        {
          "valid_from": null,
          "valid_until": "2026-09-22",
          "purchase_fee_import": 0.0218,
          "purchase_fee_export": 0.0218,
          "fixed_monthly_fee_electricity": 7,
          "vat_included": true,
          "export_vat_included": true,
          "settlement_resolution": "hourly",
          "source_type": "secondary",
          "source_url": "https://jeroen.nl/dynamische-energie/aanbieders",
          "last_verified": "2026-07-02",
          "notes": "Legacy bundled snapshot; original contract start is unknown. Values have not been freshly verified as a complete tariff. Check your contract.",
          "feed_in_fee": 0,
          "imbalance_fee": null,
          "profile_version": 2,
          "supports_hourly_prices": true,
          "supports_quarter_hour_prices": false
        },
        {
          "valid_from": "2026-09-23",
          "valid_until": null,
          "purchase_fee_import": 0.02178,
          "purchase_fee_export": 0.0218,
          "fixed_monthly_fee_electricity": 7,
          "vat_included": true,
          "export_vat_included": true,
          "settlement_resolution": "quarter_hour",
          "source_type": "official",
          "source_url": "https://www.easyenergy.com/klantenservice/onze-tarieven",
          "last_verified": "2026-07-02",
          "notes": "Import EUR 0.02178 incl VAT, monthly EUR 7 incl VAT and quarter-hour settlement checked 2026-09-23. This is an observation date, not a proven contract effective date. Export EUR 0.0218 remains unverified legacy data. https://www.easyenergy.com/media/nsfhjtjd/tarievenblad.pdf describes a purchase fee on monthly net consumption; a flat interval export deduction cannot represent that netting. No additional feed-in costs does not establish purchase_fee_export. Complete-record last_verified retained.",
          "feed_in_fee": 0,
          "imbalance_fee": null,
          "profile_version": 2,
          "supports_hourly_prices": true,
          "supports_quarter_hour_prices": true
        }
      ]
    },
    "eneco": {
      "name": "Eneco",
      "tariffs": [
        {
          "valid_from": null,
          "valid_until": null,
          "purchase_fee_import": 0.0241,
          "purchase_fee_export": 0.0241,
          "fixed_monthly_fee_electricity": 7,
          "vat_included": true,
          "export_vat_included": true,
          "settlement_resolution": "hourly",
          "source_type": "secondary",
          "source_url": "https://jeroen.nl/dynamische-energie/aanbieders",
          "last_verified": "2026-07-02",
          "notes": "Legacy secondary amounts retained after 2026-09-23 review. https://www.eneco.nl/duurzame-energie/dynamisch-energiecontract/dynamische-tarieven/ confirms the mechanism, not exact universal current fees. Contract start unknown; no new complete-record verification.",
          "feed_in_fee": 0,
          "imbalance_fee": null,
          "profile_version": 2,
          "supports_hourly_prices": true,
          "supports_quarter_hour_prices": false
        }
      ]
    },
    "vandebron": {
      "name": "Vandebron",
      "tariffs": [
        {
          "valid_from": null,
          "valid_until": null,
          "purchase_fee_import": 0.0257,
          "purchase_fee_export": 0.0257,
          "fixed_monthly_fee_electricity": 6.25,
          "vat_included": true,
          "export_vat_included": true,
          "settlement_resolution": "hourly",
          "source_type": "official",
          "source_url": "https://vandebron.nl/energie/energiecontract/dynamisch",
          "last_verified": "2026-07-03",
          "notes": "EUR 0.0257 retained. A EUR 0.02 example is not sufficient evidence for a universal contract fee. Manual verification required.",
          "feed_in_fee": 0,
          "imbalance_fee": null,
          "profile_version": 2,
          "supports_hourly_prices": true,
          "supports_quarter_hour_prices": false
        }
      ]
    },
    "vattenfall": {
      "name": "Vattenfall",
      "tariffs": [
        {
          "valid_from": null,
          "valid_until": null,
          "purchase_fee_import": 0.0255,
          "purchase_fee_export": 0.0255,
          "fixed_monthly_fee_electricity": 7.95,
          "vat_included": true,
          "export_vat_included": true,
          "settlement_resolution": "hourly",
          "source_type": "secondary",
          "source_url": "https://jeroen.nl/dynamische-energie/aanbieders",
          "last_verified": "2026-07-02",
          "notes": "Legacy secondary amounts retained. Official information at https://www.vattenfall.nl/energie/dynamisch-energiecontract/zonnepanelen/ reviewed 2026-09-23 was insufficient to establish a complete replacement tariff, its effective date and the exact mapping to EnerPrice purchase_fee_export semantics. The review date is not a tariff validity boundary. Original contract start remains unknown; last_verified is not advanced. Check your contract.",
          "feed_in_fee": 0,
          "imbalance_fee": null,
          "profile_version": 2,
          "supports_hourly_prices": true,
          "supports_quarter_hour_prices": false
        }